ID,text,label
1619360,you tweeted and ran,negative
718603,"Ultimate warrior, but my fav of all time was hulk hogan and macho man (b4 he became a bad guy) my bro used to do the figure4 on me  LoL",negative
2218884,the chatroom is sooo full devo,negative
932192,"@scottfowles Yup, had to call in sick, so nope no better yet. But my sister and mom is coming over soon. :^D  How're you today!",positive
1842048,poor guy that was shot in the head,negative
985192,"Wow, finally had success teaching our koi fish to eat directly from my hand! Quite an experience i must say",positive
113006,MyMaths has landed me with some EVIL question.,negative
517377,"off to have foodies and stuffs before work, ughhh",negative
508010,"is proud of the baby for switching seamlessly to the crib, but misses getting her face pushed on and snuggled against",negative
1715379,had days off this week lots of work pending,negative
2134537,my daughters school messed us around for days with our leave application our aus nz vacation so flights are now  more expensive,negative
1816628,speakin of books i got new ones today yay but the store was outta inkdeath damnit,negative
1411845,@tommcfly I like you having your seperate ones but if you had a mcfly account I would follow it,positive
805177,@JohnFletcher yea I'll meet you in the town center bit or something,positive
3069510,got a sound check it was amazing and mcfly is here,positive
380290,hello morning twitter...i really cba to work today,negative
900133,"omg, I never knew that Wikipedia also lists the shades of colours, it's cool",positive
152070,Going to bed. Should have done so hours ago but decided against it. I hope it rains again tomorrow.,negative
379491,wishes she was in Shenzhen where everyone else is.,negative
694874,@katyaronoff I was up at 7! For no reason!,negative
360498,Feeling really sick today.,negative
1660983,but i go to work today,negative
2110146,am still packing,negative
723517,@ComptonAssDeezy my day is pretty boring..  just went to the beach for awhile.. that was ok.. but eh. could have been better,negative
2055390,basically i agree but the free account has too many limitations and my boss is not willing to pay for vimeo plus money rules,negative
1670729,the team is spread to pieces in different cities and offices no way this easy way i want to make it work more cooperatively,negative
2012736,feels sick from the full english my mum cooked this morning i cant eat on a morning,negative
404972,im never gonna give my phone to a 2 year old again all they do is rearrange and delete your apps and everything else on your phone  greatt,negative
2452444,i love when my husband plays this song,positive
276150,had a great weekend and some fun in the sun yesterday afternoon.  Note to self: must be aware of the slippery steps going into the pool.,negative
2482488,good morning peoplee looks like it s going to be a nice day today better than last week it was raining,positive
745743,Just one more week...I think I can take it. But it hurts so much.,negative
1163659,@jannerieanne really? it looks fun.  why annoying?,positive
175630,@themaguire maybe one day I can be on your favorite producers list  lol,negative
1339691,A 1st grader just asked me if today is &quot;opposite day&quot;,positive
2610086,it s all about finding out who has changed the most eh not for the worst just quot really you re doing that now quot situations,positive
2094738,one did that once and it s beak went into its brain but it was still alive and all suffer y so we had to kill it,negative
2469633,oh hahahahahaha but no seriously i tell the wait staff they look great all the time its the easiest nice thing to do,positive
779891,i wonder how my fever dog is doing.,negative
191513,only 3 more days of sunbathing  Going to get dressed to go to the swimming pool now,negative
1955078,so sorry to hear about your cousin hanan you and your family are in my prayers,negative
1153557,"Suppose I'd better think about taking a shower, getting dressed and leaving the house. Better than thinking, I might actually do it",positive
1185208,@RMandJG wow.. I have no doubt that hurt.. ouchies.. yea.. I'm good 2 go. just slightly hurts when I twist my wrist.. all good tho..,positive
2923285,back from my fab holiday and sort of ready for work still recovering from steath at thorpe park undescribable feeling,positive
2028929,no radio show today after all host of imi techtalk has personal conflict i think they will air a rerun and we ll reschedule my show,negative
2732340,not much here yet the busy comes later,positive
2464985,nice i must see this,positive
610382,"@LolaAM Hey Loley, we haven't talked in a while. not good.",negative
946340,Remember when i said i was packing? Well i got distracted. Im packing now. I think,positive
1989152,just watched drag me to hell now watching the haunting in connecticut,negative
1398,"Hates hearing his girl being ill, nothing I can do though",negative
2994159,here s my new article with my reference to you,positive
344541,loved Kent has been back a while but REALLY wants to go back,negative
1195682,@lesliewaltzes you're actually going to play wow?,positive
3064820,every monday you tell people what they should be listening to,positive
2557699,i know it s summer but i have never been this stressed amp tired good thing there are sweet things in life like your goodnight kiss,positive
3120150,home sweet home at last this week end i badly needed,positive
1846302,s all good anyways homie my net is about as good as dial up atm,negative
590552,@nstick13 unfortunately all the destination weddings in Egypt were booked that day.  We had to settle for Willard,negative
580912,Is there really nothing to do,negative
850467,"@perezhilton Hi Perez  i go on your website ALL the time. its addictive, and miss california was wrong. WAY out of order  neelam x",positive
2350739,earflap hat progresses well i might be quot over thrumming quot though which is a bummer but oh well anyway i ve used all my roving,negative
1252781,Excited about seeing my Sis in Law graduate from Nursing School on Friday!,positive
936228,@tonitones Lucky u!  You got my 2000th tweet!!!  We must share a glass of vino over that    was totally unrehearsed too!,positive
924688,"@dzse Well he has us around him, so he is OBVIOUSLY paranoid",positive
2395162,not sure if that movie was great but don t care it was like a warm blanket of childhood memories and replacements tunes,positive
2425534,here s another one i just had to do it,positive
756439,"I have work wayyy too much this week. Also, someone stole my desk at my internship and now I'm under the cold vent.",negative
135967,@cyberiagirl  That's sucky!,negative
1167678,@keithemmerson Why thank you  I'll also accepted obscenely dark chocolate of 75% cocoa and over,positive
1078855,"@DannyMacRant  Cool screen name. Nice tweeting with you, gotta work dinner now. Let me know if there's anything you want to see on site",positive
118955,"@mbaltusk , thanks I did check those out but I just can't find anything tempting, chicken is not my fav while pregnant",negative
965073,YES just got word two posters of mine are going to be exhibited in Milan!! good50x70,positive
2474988,just got a ipod touch downloading apps for it now,positive
1381878,"Such a nice night, loving all the things which have something to do with you NIGHT ALL!!",positive
779012,"Hot and sunny in singapore right now, but then its like that every day",negative
2638287,you re too kind thanks for that look forward to seeing you on thursday,positive
395861,hugest cockroach i've ever seen was in our bathroom.  ugh.  this is one part of florida living i can't get used to.,negative
1636475,just woke up feeling confused and anxious about upcoming events can t like that,negative
2779828,good morning we sent a mail to mashable to review hope you received it,positive
675662,@eternalsunshne: I wish I could go with you  you're my favorite.,negative
578257,FishFish is already dead,negative
449999,@The_Monarch I SO don't know what you mean- I don't think I have any Korean cartoons or avatar shots on my site (do I?) I am so confused,negative
2543599,sounds like fun and acupuncture is great hope you are well,positive
1966029,well my roof started leaking last night the rain was so fast,negative
2612403,seattle is great,positive
1730811,argh i just got my packed from h amp m got a black cardigan they send me the wrong one amp and the sleeves were sewn on wrong,negative
2833718,here s to short days and cancelled classes,positive
847197,"@tommcfly the first part of your status threw me off at first, but now that i've read it properly...hopefully you win the lottery?",positive
350725,"@johnbiehler I see that a lot on my commute, solo drivers using the HOV lane.  too bad I can't ticket them!",negative
2751986,yay for beers with tania steve and my parents,positive
2917541,lol well i might be going to a summer camp in la and he s gonna be a guest last year selena was one,positive
2470612,wolverine was much fun but gambit was a bit disappointing neither smooth nor cajun enough for my taste pretty though,positive
2974082,everything about virtual dating assistants seems right to us,positive
32557,Eating at ihop using their free wifi since i dont have internet yet,negative
685787,"@LuvinMeSomeD Oh, me too.....He was AMAZING....",negative
1921673,i m sad i sent some feedback to taco bell and they never got back to me,negative
516764,It is to hot to be at work today,negative
1667731,jonas brothers d concert movie is out on the th of may and i can t go because of school interviews but i ll see it sat hopefully,negative
1916725,ughhhh i hate that its gonna rain tomorrow cuz i really want to wash my hair but it doesn t do well in incliment sp weather,negative
3047349,hopefully you are coming someday i ll be waiting,positive
2281256,this my first time watchin this joint in a while this jackson american dream joint is sad as hell,negative
2070599,aghh we ll miss each other by a day i m leaving mpls on saturday morning,negative
534171,Here's to a better night then last night otherwise heath will just have to miss work and take me to the hospital,negative
2874197,i shall follow your wise advice and keep it like that thanks,positive
658384,woops forgot to update this too!! grrrr.. anyway i miss my friends!!!  More people need to email me! Ugh. what happened? did i die? lol jk,negative
1103145,@mattyriley iced coffee is pretty good!,positive
2355899,game game game shucks i want half moon now i miss it,negative
2864803,sometimes at the gym i try and find rhyme or reason to the playlists no luck so far,positive
676274,I think vacation is making me gain weight  So much good food!! Fishing in the am!,negative
40682,is seriously fed up,negative
1763977,my car is home yay boo i m paying my mom in installments i gave her today i so need to win the lottery,negative
625514,I'm loving the Twitversation between @Whiffies and @TillamookCheese right now. It doesn't help that I'm really hungry at the moment too.,negative
2813789,thanks for staying up all night with me,positive
1247601,@Beth_Day Cool. If I went I'd be crapping myself in the corner /: ... have fun,positive
2881323,i m sorry jp but you _don t_ get the job it was a reply to about what is a good asp net interview question,positive
2859448,it s all about favour from god,positive
2922348,is with audrey trying to teach her how it works,positive
2821760,just joined the bandwagon,positive
2251572,have lost location of the purple pencil that i desperately need,negative
2219500,just landed i have a headache,negative
489940,@maeveeee just had our last REAL day of school  clave your page in my yearbook is getting cold,negative
155952,@lisarinna BEST OF LUCK tonight at your book singing!!! I wish i could come but a bit far for me since i live in Georgia   Come to Atlanta,negative
1602770,off to the hospital soon kinda sucks i m not allowed to eat anything x,negative
306429,every time I upload an image my colors reset  and my image doesn't get uploaded either,negative
1757334,being lonely all the time,negative
3082329,at least you re not shaped like an oreo,positive
1047475,"Holy crap it's 18C outside.That's almost as hot as it's gonna get the whole summer  Glad i've got the morning off, i can sit in the sun",positive
1793339,wife agreed to neighbrhood garage sale then leaves at a for workout sticking me with managing the store i hate garage sales,negative
1478154,@frankispeace Might be. He has always been a tad absent-minded.,positive
1671675,i mean alexander ludwig but he won t just reply,negative
2087508,too tired to go to bed,negative
2321766,ugh have to clean the house,negative
659774,"Plan B did substitute plan A, so now I'm stuck with plan A",negative
3025912,lovlesmile lol i know i know thanks i was starting to feel all alone lol,positive
2962900,most of our stuff is prepped but with two kids to look after things often do not go to plan,positive
2466722,pretty happy with how things have changed over the past months definitely for the best,positive
151250,@elizabethuhl i really miss you.... like a lot,negative
485897,"0x80070002 damn, what has happened to my computer? it's a veggie now! a Windows update last week?",negative
65988,Delayed for a while now at SFO. Thought these short flights would be easy,negative
110906,"Mood hasn't changed much. Still feel like a fat, ugly, useless writer.",negative
1645481,oh and i really want the t shirt with the super records slogan but that s not on the site either,negative
1699540,for whatever reason seems to take a couple of days for tweetie to get the avatar updates,negative
2499692,what program or what did you use to type chinese just out of curiosity and totally loved that chinglish u useds,positive
1848378,not happy won t be able to hear on friday night i am working damn it,negative
1943318,i had to finish payroll early to work on this project for the laywers that i so dont feel like doing,negative
316150,"...I really hate work on Tuesday morning after a bank holiday....and also, Stanstead Airport is possibly the worst Airport in europe",negative
134397,"rawr. I go to jamba juice, they're closed because of a power outage so I go to starbucks. when I come out, Jamba is open!",negative
1268136,Trying to figure this out. It helps when I remember my screen name,positive
991315,@akyna abush? ambush? i'm sorry but i totally seem to have lost the context :| please explain to dumb ol' me,positive
2804935,just had the worst tuna sandwich on the upside i have plans for drinks in the city already,positive
2608225,just got home and sorting myself out ready for a heavy night in london i get the feeling it could be quite messy tonight,positive
3099569,i am going to watch again,positive
494885,"I have a bad cold, very very very bad cold",negative
575505,"I get really excited when I see I have a new follower. Then I see it's not a real person, some Sex-ed thing or game twitter",negative
554751,@mtrh a not as fun,negative
1687559,dealing with a huge hangover thinking in how much i got to study today and about him as usual,negative
486021,Extremely tired. Need sleep but also to do hw.,negative
2558185,don t know but i ll give it a try and let you know,positive
1319603,@nettekulet wow cool! Sorry if I disturbed you but I just have to say that I'm watching HP3 now. share lang. Hehe HP Day?  enjoy!,positive
1840671,i am soooo excited about the new moon trailer but i have to wait until tomorrow to see it it ll be too late here,negative
577723,@computermilk Thanks for the tip but it is a wireless network,negative
359363,in class. don't wannan be here,negative
549329,is going to bed. I feel super bad  night cuties.,negative
2324904,thinks its sad that jon and kate are quot separating quot,negative
2196125,once i ve finished they re out of my hands though,negative
2841052,birthday was amazee can t wait till saturday though be there pm d,positive
1984270,bodies found from air france flight,negative
420204,Did I miss the party??? I keep seeing all these texts in my phone I'm at the club!,negative
1978186,i used to live around the corner from magnolia bakery personally i think hummingbird is really overrated,negative
727003,@CuddleMonster4 I work until 9:30ish on Wednesday.,negative
1660556,stayed up too late last night volleyball tournament at last one,negative
785535,@sapphire_city sometimes its even hard when those things arent happening,negative
341190,"@Jeanettecole yeah, they mention the plane is a fly-by-wire type so in case of electrical failure plane is uncontrollable",negative
464375,in what is starting to feel like my natural habitat... an airport terminal,negative
713956,on my way back from younglife camp  i want to stay forever. best week of my life!,negative
795218,Siavash is growing on me. I quite like him. Hope Freddie stays and Angel goes. Hate Charlie for ruining her eviction outfit.  bb10,negative
683635,(I loved him deeply; he hated my guts)! May God Bless his soul  Sorry for the short tweets from my mobile phone,negative
1242010,"@the_beacon  I was on the train home, it's in Fermat's Last Theorem and I smiled. A geeky sort of chap saw me reading it and smiled back!",positive
614643,"I am sad, Thunderbird is simply unusable these days.  I have high hopes for v3.0.  But for now no soup",negative
2473489,just got home after an hour at the track i feel real good now p running is nice and abs work and push ups haha p,positive
1286330,"@bdufresne BTW I was in La Chaux-de-Fonds this morning  business trip, mind you. Back to LSN this aft.",positive
773021,"@allthewine  that is sad!!! He was so great to talk to, maybe if he had his profile set to private...?",negative
11028,"cedar falls are looking for therapists, if only i could drive!!!  id love to work there...",negative
1946633,what s wrong with t mobile g today terribly slow or no connection at all,negative
1291601,"@nuteile I'm afraid of attracting more! Also, get I'm revenge in? That sense no make  Fill with what? Beer?",positive
879623,@leenkwan I believe so too  you can do it! *breathe in breathe out. hehe just like that!,positive
2320201,i have a fever of i already went to the auto parts store post office dr office and pharmacy now i need to clean the house ugh,negative
120864,nostalgic mode....saw pics of old classmated on the net today...how i wish id get to know where and how theyre doing today,negative
2671896,more followers and i ll be at,positive
2025866,ok day of science fair project work i will need fortification for this as the bagelry neglected to put my bagel in the bag,negative
2088528,wishing things would change tired of sleeping alone and constantly disappointed,negative
113719,says the prayer meeting ended but it seem that nobody here is online...  ,negative
2868571,shopping with mamaa,positive
801540,Having a pleasant convo with my momma boutr hurting people  lol,positive
2085564,ps took a dump,negative
2178731,struggling with tools chosen by someone else for the teams teams not in agreement about usage some like it some don t,negative
150939,needs to get high but my piece is missing,negative
2549707,is back at home today was a very mind blowing day new knowledge acquired,positive
267580,"Missing my lover already, wish he was here  Going to sleep now I guess.",negative
1407453,Mom just bought Pollo Rico...hell yess,positive
1153116,May I say I lost my voice when 69 Boys came on stage with @locashcowboys Holy crap that shit was crazy! and...at the Country Club!,positive
2295762,round headed kid and what s her name met with a quot trainer quot today now they think they can boss me around if only they didn t feed me,negative
772227,stupid old 95 Saturn...radiator just overheated and leaked.,negative
776595,I'm so board. Too bad I don't have anyone to tlk too.,negative
2463862,the dj s and partypeople were great again at cc kicking next one june,positive
1705858,will be missing church and everything else today stupid cold,negative
2405693,ah u got the morning after syndrome i c,positive
1926231,religiously following stocks in red now,negative
937211,"@Tortue That was what I did, going to see the movie tomorrow afternoon",positive
2669031,great day today weather was fit did some office work cycled miles done some weights and ate a tiger prawn salad now glow ball,positive
3039676,back to work i miss the weekend already,positive
208798,Is leaving salem today  but turns 19 tomorrow !,negative
517492,finals this week,negative
1808437,yeah and i m not even gettin paid,negative
1762461,my computer got screwed to hell by viruses i just finished wiping the drive and reinstalling windows xp i want a mac,negative
1797811,funny iam getting the next iphone and iam getting snow leopard on my macbook in october my macbook pro is only for buisness,negative
2232663,that kinda makes me sad i thought the loyalty plan was really cool of t mobile,negative
3107696,rusty ibeam perhaps this will kill the cloud and gives us back control of our data,positive
1165963,sun is good,positive
2171183,i ve never seen it i am not much of a movie buff,negative
499548,@YouKnowTheName  that wasn't a serious question right? Lol,negative
558148,just realised that florence +the machine cd i bought was a pre order got to wait till 6july before it's sent. sadface,negative
414724,@rebo11 i went to work 12 hrs,negative
2089092,i had a weird dream with my crush in of last night we kissed i miss him no it s not nick jonas this time,negative
829697,"@papastack Dude, you are going to Rock Sunday morning.",positive
1260336,@ImSOposh - Who has one now ... When I make it &quot;distant&quot; cousin ... I'm going to release my own,positive
2097250,wish i could be there but stuck in london good luck to you all lets have a rapha condor win,negative
326171,I forgot my iphone at home. I feel naked without it,negative
1709370,why does it have to rain today want to go out on my motorbike,negative
1534564,Hoping to cross-enroll tomorrow. :-/ Lecture classes officially start today.,positive
3104748,has a face for the radio,positive
2982468,i ve already starting retweeting too we ll get them up there gorgeous x,positive
318462,@MarandySavage dude...i'm in the airport watching that news...INSANE! I'm glad I'm not flying over ocean,negative
931968,@mileycyrus You can't tell me your dad had a Twitter account for like 5 days without you knowing about it.  Say what? LOL,positive
948272,"@CatyEyes Cool, glad you're enjoying it! @MoShang is a really talented artist -  has lots more great tunes",positive
590508,@StephaniePearl booo  I hate it when teachers talk just because they like to hear themselves hahaha.,negative
2221933,woooooop i just woke up and it s after noon and my stupid grey s anatomy illicitness is only on not good,negative
2453021,i feel good with my progress and it doesn t matter what more i accomplish but i know i ll be satisfied when all is said and done,positive
651174,@JamieDScott because of losing your best player? :o A whole 4-5years gone  Who you off to manage now?,negative
2877533,hey congrats you made it into the top,positive
2628254,me too i m going riding at his house next week sometime,positive
1549807,iremember when all i wanted was to have my prince charming find me &amp; we ride away on horses or in a carriage,positive
1476708,@letsdrawmistle yeah i know  its back now though  I LOVE YOU SALLY BUSTER,positive
2545017,i m downloading songs to my sister s phone how are ya doing guys,positive
1324266,@MC_mahon aaww awesomei bet that was good!,positive
2617018,off to to get a little work done stop by and chat,positive
273539,@wfaaizzy  I can't believe this stuff still happens. Amelia Earhart would not be impressed!,negative
1602209,has just realised he works with a bunch of racists,negative
2587669,friends were so cool and down earth it was fun,positive
88024,"Going to Conway Arkansas to take adia to her dads, on mothers day",negative
471373,I don't think office life is for me.,negative
2325191,umm that was short lived now i have a huge test amp not so huge test if you don t see me for the next four weeks its because of school,negative
2765686,well its a nice day the garden is probably the best place to be,positive
931706,"@foxyfitnesschic hey I finally added you to my blog list Yay! Hope ur mom doesn't kill u though, else 1 person less to follow my recipes",positive
3122217,looks like you re all enjoying the  k links promotion remember it s on all week,positive
546264,is super embarrassed that she was 2 nervous 2 sing  messd it up! Ugh!,negative
139662,Oh yeah my PS3 broke probably from playing too much COD4,negative
1872090,me too i m at the point in my life where i feel like i have to,negative
47748,It's 8:30pm and there are still 10 things that need to be done for today,negative
1441019,I need a job...I wanna be an actress  !,positive
3028093,didn t get around to posting my new note card line too busy getting ready to move east expect them posted by the end of the week,positive
2348563,i know they must have been a bunch of idiots,negative
733966,Don't worry ppl. It's just dental surgery. I'm all drama now coz I will not b able 2 eat... Not Tat I can now too. I can't chew my lamb!!,negative
1716736,lol no therr werent any and if there were they had dates lol,negative
2571048,everyone add he s in my band and may at some point have something interesting to say,positive
1971490,is gettin ready to go out to club for one last time,negative
1105094,@JakeGarton well not really. but thanks,positive
1667706,ughhhhh i hate not having my phoneee cant wait until my new one comes in and i hope karma comes to the one who stole it,negative
2129433,thats lame did you watch disney though jonas day xd,negative
1104753,100miletraining trail run in progress! 4hr sweatfest 22miles going to be glad when done this am! What are YOU doing?,positive
976103,"@WookieWife yeah, I know  to bad we are going to be on set for one of those crappy &quot;step up&quot; style movies. at least it's in 3D",positive
