ID,text,label
1249154,i was ready for the storm but little did i know there wouldn't be one. it was all talk and no actions,positive
2222292,can t find my copy of quaker advices and queries the small one not attached to qfp another item that travels so much w me it got lost,negative
2478277,is resting ahhhhh i feel good,positive
2797732,my forum name is shayrenee i just signed up like days ago i started a topic in the new people section howdy lol,positive
1646158,missing beavis lots even though he is at work and i am at my mummy s i just want to see him,negative
3054601,i d almost bet that you re following or being followed by the guy that won it too next time,positive
384155,@thisisrjg Only 1 txt received from you today at 1011 saying good morning. Nowt since!  Thank g'dness all this will end when you move in!,negative
1955070,jumping into a pool after a bike ride is always nice except when you jump in with your wallet,negative
484671,@TraceCyrus i'm quite shocked you got &quot;aloha from hell&quot; as support.,negative
468924,@schofe wooden lolly sticks. Can't go near them. I'm permanantly deprivde of solero's,negative
1133553,Waiting for my daughter as she gets her hair colored. I must love her.,positive
640128,"At below, that always makes me feel like crying  but not in a bad way. Becky's party tonight (Y)",negative
1277142,"@nexus0321 lol. are you drunk!? i know i had a cute guy, but i need a cute guy that isn't my bff.",positive
1786068,shoe shopping done dead tired n sleepy better half still shopping browsing omg,negative
2465543,just had steamed fish w oyster sauce,positive
1089598,@kristykristyy i will but you have to donate to me as well  ahahaha,positive
440798,Today is my last day in this house,negative
2084070,im at home sick its really horrible i think i have a virus again ily to everyone xxxx,negative
415643,@seanoliver less than 4GB is unacceptable...I have the 16GB and am pretty much out of space,negative
1835976,ok i ma head to bed have to be really early in the office tomorrow,negative
2767820,my yo just called and left me a vm he said i love you mommy and it s ok to come pick me up tomorrow awww now mama is a mess,positive
49327,is up so early! Time for some breakfast then little cousins communion. I wish someone was up and would text me to keep me company.,negative
215583,And I hate when I really wanna talk to somebody and can't...little ol me gets sad,negative
2028190,just did the quot i just walked through a spider web dance quot in front of three cute hiker gurlz,negative
2190906,just found out can t drive rental car into czech republic have to change our travel plans,negative
1148033,"wow nothing like some penguins and some wings beating up on each other! good hockey, sad outcome, they'll get them tomorrow",positive
1042474,can't wait too see JB3D!!!!,positive
1289235,@BitchNotAPerson great  I hope many people out there do that too,positive
804267,@Sum41Official finally you guys are here! Can't wait for the new album!,positive
2119549,i tend to not like quot honey quot anything in my beer selection,negative
2385984,work but first sleep,positive
768203,I really don't think no cream today was a good idea,negative
1969975,just tried to post the longest comment on your blog and it didn t allow me,negative
2297788,according to my research women dont like to hear about how much a certain guy is checkin for them it can be annoying,negative
1232966,On my way to go meet MxPx with Brian,positive
1761316,i thought i was safe from the injections today only to find out my mom will be the one who ll inject me with vaccine help,negative
2797510,wondering what is happening on days and oprah god i wish i could spend a week in my pjs without losing any money,positive
2056747,having bad day no phone net forgot netbook problems at work amp can t find purse last time i had it was last thursday roll on tomorrow,negative
1667122,legit depressed miss bamboozle my friends and the hotel had an amazing time lt,negative
120865,I think I've had way too much tea today.,negative
2348197,woo finally got in and registered for classes one more stressful day of registering left,negative
1284093,Just came back from Parents Meet and choir!,positive
839457,"@gpoulet oh man!  It's A LOT different. Now, when are you coming back?",positive
2124333,believe it or not it wouldn t be the first time somebody used one in my name back in a quot friend quot stole my id to get a loan,negative
1341060,just got back from buying marina's birthday present at beate uhse  @Noah1990: thanks for helping us out.,positive
2101808,as much as i would like to stay and play on twitter i still have work to do be back in a bit,negative
379260,I'm not sure tenpinbowlingisdangerous is going to become a trending topic,negative
2911180,in case you missed it check the new love on the bloggety leave comments to let me know what ya think,positive
1968636,pretty sad to realize that giving all energy to some people can never get appreciated,negative
2263380,god i want one sadly with m to go on my current contract it won t happen soon,negative
923903,has a date!,positive
758822,@eandrew aw really  I loved ed mcmahon,negative
2567622,dress down day school hopefully this will be a good day,positive
1000555,@Les_Berry hehe sure did!,positive
1824722,wonderful weekend with husband why does it have to end,negative
1271526,I hate some people.....oopss not you,positive
2153269,it was a hard day,negative
1876637,waiting is not fun,negative
1872583,done amp done haha hopefully she ll do it and don t be annoyed your true friends in maryland love you and always will,negative
398826,should've been seeing the saturdays tonight,negative
254148,"momma dukes does not appreciate my loud beautiful singing voice, she said shes not down for my american idol audition",negative
1968186,did a song bardie toke ev he better like it or it will be a fail foooty,negative
130531,I am off to bed .. today was a Gr8 day full of things .. i am more than tired and i need rest ! tomorrow is a killing day cuz  my MIDTERM,negative
2507079,you go ahead and make your mean cup of tea i ll lure them in with lasagna,positive
955433,@tonybarrell  I  survived a year in an inner city 90% black school in Kansas City at 16...I can deal   Worth going???,positive
489979,So sleepy &amp; it's only 5pm!! Ahhh,negative
785016,coughing continuously. my throat is so dry,negative
1431981,Bought a fish. His name is sketch,positive
2312565,no it just reopened a few months ago,negative
3137328,$RCL lost over 16% and is Monday's worst performing $SPX stock; $NCLH lost over 12% and $HOG lost over 9% while $TDG $CAT $GPS $SIVB $UAL and $LB all closed down over 8% on the day trading,negative
3111339,i am headed to work i love my job,positive
2885161,so advertise let me know when you have your first paying client feel the fear and do it anyway,positive
2460146,buying luggage for london is nothing short of exciting,positive
272607,tired of having to mime or write everything down. Never realised just how much i talk in a day,negative
2218822,just had final hamlet set updates through from keith osborn am going to miss the keith s texts,negative
2056439,lol no it wasn t me but i was tempted to go by today actually,negative
1201894,"I have wasted way too many hours this weekend on Infamous. Had a blast mind you, but now the weekend's gone.",positive
410945,I feel really sick,negative
2680776,does the shop ship to norway interested in the autographed posters,positive
770266,Grrr that last tweet was supposed to end with grrr... iPhone autocomple ftl,negative
2069015,just miss my man weeks til i can see him again so hard after getting ish days w him that were so perfect,negative
2629794,that s a great thing mine has x zoom but not sure how far it extends,positive
958814,"@MoocherGirl so, this is your night time!  Good night. hope you have much better luck than I did.",positive
187892,"Seniors, please don't leave me. Please",negative
140781,@clarisatata Hey. SLR.  I was watching some videos. I was hoping if we could go to EK. Would that be fine?,negative
1394356,"Sorry for not staying longer at coffee TU, hopefully next time I can get to know all the @jtug",positive
1715326,my little boy went home today,negative
1880044,what s so creepy about said roommate stay safe,negative
2877089,is loving quotewerks and should have taken advice to implement it a long time ago,positive
601989,@ryan_buell Heard it was awesome but been too busy to go see,negative
283068,"@rafik problem is people, not technology, sadly.  cfp09",negative
2187249,not having a good day baby didn t sleep nanny on pto amp i rushed off to work in flipflops,negative
1862234,imagine how i feel supporting the knicks oh dam did i say that out loud those poor sorry knicks,negative
1886363,packing is soooo overwhelming and i have to pack a house,negative
946843,@Rascalbear most popular movie right now. I went with no expectations and had a great time.,positive
2012141,i really cba to do any revision i should cuz my exam is on tuesday but i cant bring myself to do any,negative
3005665,tired but working just so much to do but i want to be in bed watching dvd s and doozing,positive
1380928,Just got in had a blast,positive
860241,I'm going to make the bf turn green with envy tomorrow when he is looking like milk hehe,positive
2529036,is home from disneyland too much fun,positive
704358,@Byrnesangel   Theyve just recorded a new album should be released soon...cant wait! And then a tour to follow! Yay!,negative
1077811,"ff @vanillabean45 The most beautiful, funny, newly photoshop using wife ever, you should follow her, she'll make you laugh.",positive
177487,@TheEllenShow Ellen..why you got to lie?   I'm so sad rite now.,negative
827170,eating gold fish :0 Yummy,positive
613714,"I feeling well rough! coverd in vix,smells good,but not working!feel like i'm in an oven! since when did swine flu affect none mortal me",negative
2866165,haha well i have of them following me haha,positive
2680054,i m so happy for you and look it s time to go home,positive
2456992,awesome good luck in getting your next,positive
2395348,you staying in la i ve got a live autograph from you coming soon i hope,positive
219190,I just came home from a nice walk by the beach. It was so cold and windy,negative
2259164,the weather is soooo bad i think we might lose our power,negative
1914984,any big plans for tomorrow hope the weather is nice at least we ve finally hit low s with help from sun tomorrow cool and wet,negative
2654812,oh yeah tim is here lt i love him,positive
393735,"@leejonathan 1&amp;2 are in our fave films of all time,we walked out of the 3rd one in sheer disgust.we hoped bale would improve it this time",negative
2489364,please to meet you hope you guess my name,positive
151500,It seems emily's mom doesn't want to talk to me *sigh* there went the only friend I had,negative
1663450,off to work see you guys around am,negative
1655537,pretty exhausted but can t fall asleep i have been dining with the enemy it was a wolf in sheeps clothing now it s so clear to me,negative
2569853,just woke up going to stay with my nanny in a bit glad its finally friday,positive
1019909,@jbella21 ahhh after the 2 shots of patron it was all a blurrr lmao...i had fun with u tho,positive
85160,"im tired, yesterday wasnt as i had imaginated !  love ya ?",negative
2681401,oh it s all right these things happen thank you though i am pretty much stuck at home cause of this storm playin music,positive
277489,"@quietsong Termination is a generic term for leaving the company, no matter how it happens.",negative
2767082,yesterday was fun went to julie s reception and then watched a movie at ginger s i m gonna have some ppl over today for gh metalica y,positive
2648205,it might be a good day to do the lotto the weather is holding up last night was fab and good things are supposed to come in threes,positive
1452185,went shopping today!,positive
1363077,abusing hotel wifi to talk on msn at stupid o'clock,positive
1442760,very tired cheer tomorrow!,positive
864040,"@ComfyPaws me too. Maybe one day it will again bring me comfort. I have to go to bed, nite.",positive
2595310,i vote glee i ve watched it a bunch too,positive
1398498,is thinking that buying a shiny new car is definately a good idea,positive
2991563,i am aware of csi dipped into each flavour but i try not to do processed tv will check out that ep on your recommendation,positive
2424469,i could spend hours in that place actually i did tonight,positive
2595683,hmmm i might have to swing by for this happy birthday kristen,positive
2517694,i just managed to staple my notes to my cardigan sleeve maybe photographic evidence of that,positive
2939055,had ice cream yesterday it was tasty what s your fav i m partial to pralines and cream have a good one,positive
2136987,sounds like you re having a great trip,negative
2542764,was on first minutes of first date in fullerton during earthquake but i told my date quot the earth moved when i saw you quot great icebreaker,positive
26396,@NnennaStella ah shit! I wish I could come  I'm on my way to &quot;volunteer&quot; in glendale!,negative
2217348,i wish i were me last fall,negative
2354374,nah relieved however very emotionally draining i suspect i m already having flash backs,negative
2484541,i ve decided i don t like perez would love to see you two go at it in a cage match love you kirstie,positive
1918499,i do too ah well stole my i am a scorned ho,negative
424713,My last night at work is going by super slow!!!,negative
2647000,ooh do tell more btw you were right about the pinstripe suit lady she was back today for it she s lovely,positive
2860747,has changed his default search engine to bing,positive
512920,I don't think the person knows  ah well I suppose it serves me right.,negative
2357594,sad today my inlaws dog died only found out she was ill last week thought she had a few months yet rip ellie x,negative
1718243,urgh maths gcse today not ready fail today is going to be fun,negative
2878681,i staying pretty late last night listening to a live to tape prince concert on the radio it was well worth the lack of sleep,positive
2609264,and love story by is the only song i can listen to and sing on the top of my lungs on repeat knows whats up,positive
208939,bgt Susan Boyle is rushing every single phrase! Slow down and it could even be good! Some of those notes sound a bit off too,negative
376471,@katzworld I know some of the pain. My iphone wouldn't do spymaster tasks at all to day.,negative
2587788,just purchased educate app for the iphone report coming soon,positive
2063442,and aww man i m dying here wish i could listen to all the blips but not allowed to stream music at work,negative
2609447,wise you look very wise for a young grasshopper feel free to take a stab at my age any time,positive
1322744,Working out in the sunshine with the 3G dongle - what a great way to work in this weather.,positive
1801420,i need to start working out again i m getting chubby,negative
3044100,sitting in the rents house letting them look after me,positive
275546,"hi ho hi ho, it's off to work I go.  This weekend was too fantastic to give up.",negative
2757269,tonigh was awesome up was so cute,positive
131679,"Tired, and taking a test",negative
1770535,would like a hug and a kiss from eric long distances really really stink,negative
1956431,they don t have album at fye i have to wait now,negative
1752378,watching carnivale i should have gone to school,negative
2374059,anytime sis,positive
2983676,where do you go to college,positive
112764,"@geminianeyes: Nope, I didn't. I need to pay RM1,038 if I wanna take her home.",negative
2118055,called me fat and old unfortunately she s right,negative
2237999,lmaoooo he says i must trip over when i walk my age is fucking though d thats so good lmao,negative
42614,I want to follow people,negative
2668386,with the fam they just came back vaction from jamaciaaaa yayy they backkk with my babbyboyy,positive
875824,Talk went very well. AND got signed copies of both of Ray Kurzweil's books as a gift!,positive
2903939,i love your album i listen to it constantly my favourite album atm xxxx,positive
1669665,yuk it s a horribly wet grey day outside,negative
1290157,at school .. it's very cold here,positive
1181350,"sunday fun day!  what to do, what to do!?",positive
40577,"I quite like dubstep, but doesn't it all just go wawawawawAH wawawawawAH wibbidy wibbidy wah? Will soon tire of it methinks",negative
2379396,it s nice to see that someone with such a large follower base can still take time to notice the small guy too,positive
2468273,yeah it s great always something interesting going on,positive
624198,"@denymyradio well, I'm sorry to hear that",negative
702649,"@kneeeeecole yes you do... Currently I'm sleeping on a mat, I need to get my mattress foam, I know how you feel",negative
3118663,i think your logo is my new favourite what do you guys get up to in chelt when you re not making pretty things,positive
353449,@DeleElias I'm gonna miss him! He was a blast to work with  It's always bittersweet.,negative
1269683,Conan on The Tonight Show was good,positive
482889,"home now. took the kitty to the humane society...safe journey, kitteh.",negative
118789,"is feeling pants, slept all afternoon and am still wiped out    oh and the kids are back too",negative
2765700,sheesh need to stay xtra mins to finish a download now or never while listening diff versions of quot apologize quot thats nuts haha,positive
2714044,race for life comleted in mins fab experience but a bloody hot day will definitely be doing it again next year,positive
1336676,wouldn't be a normal day without two emergencies in the first 15 minutes.,positive
1573207,@savorsouphouse I still need to get over there and have one!,positive
2525569,was great hun such an amazing night the guys are all so lovely,positive
1423410,@hughsbeautiful from yesterday  I am going to post a picture of him alive and well. He was only ickle! X,positive
1899497,back on base that my p i c left but i think there may be something more,negative
57723,More slab laying today  Even though i never did anything yesterday!!!!!,negative
826729,tonight was deff. a night that i havnt had in a longg time -- a fun one,positive
515245,I'm not watching enough porn,negative
2687779,really like the swalvo church,positive
2654268,it will be controversial as hell,positive
2125616,so i was able to catch the colbert report last night and his haaaair clutches chest i want him to have his hair back,negative
1352057,"@AlyssaNoelleD i might watch it tonight with my sis (: hah okie dokie,but i live in england so you'll have to tour here  and k i cant wait",positive
3014534,i understand it is a hike just let me know battlestar hannah is welcome as well,positive
2183807,not doing well with comfest rejection today i want to be busily preparing like all my friends,negative
2422010,tessa rescued me again thanks to all the net people who are so supportive it is ace,positive
2841598,have fun in the studio today saynow perhapss,positive
431962,Need to start learning Spanish too. Can't believe I'll be in Ibiza this time next week. Scary! So much to sort out,negative
103411,awww the first not-nice day of senior week   what ever shall we do since it's too windy for kanjam,negative
1289725,"I'm ontheway to istora senayan, audy mia @citracitzy vanni was already there. We'll watch pcd beybeh!",positive
608907,It's raining   It's supposed to rain this weekend   Need a book?  Check out our Staff Picks or ask a librarian for a recommendation!,negative
2099709,i have problems with lj haha its only me,negative
2186551,just dropped chels off at the airport another year until i can see my best friend again,negative
239066,is starting to hate the summer all ready. too damn hot,negative
547364,@LAFYgrapevine there were also music and commercial breaks that took up a lot of time.  thanks for trying !,negative
2889480,and the winner of miss indonesia is derengdengdeng karenina halim dari jakarta she has a very good and fluent english,positive
1343955,"@Animal_Chin_au yeh, i did but then didnt realise it was already set on 8p pst. got confused,. all good now",positive
1449945,I want to be there @ stephanie and fredy and al the party people! this afternoon I'll be there,positive
369600,There was no service  and u were doing ur hair,negative
1564661,Really starting to like Lexi,positive
1780387,day was my bro s th grade dance he had fun lucky him day was also the th grade dance but i couldnt go cuz im in th grade,negative
262197,@TraceyHill me too  but lol @ kristin cavallari being advertised as 'the bitch is back',negative
2322176,hurting all over,negative
507632,don't know how to help my wife. migraine + nausea.,negative
2714772,well one of them has now appeared will wait and repeat the process strange these people have been following a long time,positive
1158797,@GenderQ which is?  you are killin' me with the suspense,positive
357745,I am very very very sad. I have officially run out of contact lenses,negative
2000883,yep on all four corners where my wrists rest and above the screen,negative
1561370,@camerondavidson all someone has to do is bring him over,positive
2194717,i tried you was too busy havin other convos i m hurt,negative
607454,"school, my tumy hurts",negative
602038,@CoolTails Apperently its paypay for you ukers,negative
92839,Leaving Alaska at 9:30pm AK time tonight. Already at the airport. Boo hoo,negative
3078504,at home with the mouse,positive
949033,Goin to bed. It appears to have stopped raining cats and dogs. I wanna dog. English Bulldog,positive
153722,"In Arabic class.  to further explanation needed, right?",negative
238444,is studying for his finals,negative
958356,@ ThornesWorld Thanks for the follow - it's nice to meet you! BB,positive
2120195,i can t even skype still dont have my laptop but yeah me and my boyfriend broke up,negative
1887064,wish i could have some fun times this week but got loads of revision to do i hate life during exam periods,negative
2216999,sent the letter scared for her to read it now oh well had to get that off my chest goodnight twiggaros,negative
748508,NOWAREHOUSE shut down by the police. they're looking for new spaces to have shows in bmore. help them bruthas out. police=,negative
829527,Just joined up,positive
2294384,it was slow but whatever we were running late and i didn t get a chance to check you out can u dm me ur,negative
3067824,play play play,positive
14531,tired... so tired... tired of work... tired of life   in need of money or a long holiday on a beach,negative
468113,Rain does not make nice going out weather,negative
883469,"@Transitionqueen I am officially coming back to reality tomorrow   Transitioned 1st w/ email, kids at school, laundry, course this w/e.",positive
550344,@Rove1974  You got married! i didnt even no u were ingaged! im such a HUGE &amp; obsessed fan &amp; i didnt even know   any who congratz!!! XoXo,negative
205469,The toro's came out today and I have no money..,negative
2697445,you have a lovely singing voice,positive
1655888,just got up and gettin ready for work hope its sunny later on lol,negative
2341519,had to work longer than expected due to no shows my plans were ruined,negative
664136,"Ah  get it get it, get it at me! And someone make my friday please?",negative
2935435,going to navy pier goose island and the chicago zoo with and then the game,positive
1330102,Good morning!  It's a beautiful cold sunny day! I love days like this.,positive
2445526,i had one week vacation now one more week to go,positive
686112,"@ZucchiniBikini There was really only one person I was hoping to hang out with for even just a short time tonight, but he's unavailable.",negative
1684412,sux rs to be you i m just having coffee now too if that helps and i shouldn t,negative
2581376,pink floyd s olearning to fly quot is on the radio i don t think i ve ever heard it on the radio has to be one of my all time faves,positive
2344044,i have to attend a reception i think,negative
776045,@DavidArchie your brother blocked me and said i was weird because i said im a big fan of yours,negative
2891565,thanks for the follow ok to add you to xbox too,positive
474142,and my english sucks today,negative
2996040,playing farm town amp amp pet society,positive
220749,dance flick: not as great of a movie that you would think...all of the funny parts were in the commercials.,negative
2954598,tweeted me thank u soooo much even happier now,positive
247431,Twitter won't upload my new pic  so sad,negative
2764885,that show is awesome,positive
709447,@arwatts NOOOOOOOOOO! No I don't allow it  ill kill her when she comes back to georgia. Wait how do you know?,negative
116101,"@amandapalmer DON'T LEAVE US  going offline = dating someone, get too involved, draw back, only to become more obsessed upon return, haha",negative
804994,"Yay, watching phineas &amp; pherb in bed. I love this show",positive
1300837,"had a great weekend, now it's time to put in workkk!!",positive
66060,i wish i had polarizer for my wide-angle,negative
2263551,i miss senior week i miss getting drunk by the beach and meeting strangers next year hopefully,negative
54754,downtown not happening  freakin economy! oh well.. i guess I'll break out the chips and dip and watch some movie from the 80's all alone.,negative
2335879,born to be wild at mph on a cc not so much,negative
464504,Walking to Old St tube. Feel like poo. I think i drank too much guinness.,negative
802851,"@Adoracion i know!!! i'm excited to watch it too!!!! i have to DVR it for the boyfriend also, how silly is that?!",positive
1552536,@NightShade10 Good luck on your meeting as well!,positive
1570509,@sarah_janes He does seem like a keeper.,positive
1930386,i hate having lots of errands,negative
2514562,thats great you are the best actress and todd and lincoln are the best actors how are they,positive
92432,Ohh no. Monday means school.,negative
