ID,text,label
504569,"@sirjamesw nope, they close at midnight for construction and they wouldn't go in the back to find the box with the cds for me",negative
2568769,ooh it was haagen daz s so more ice cream than regular cake hv a gd eat eat wkend,positive
891195,@firstaidrn so when are you going to actually use it?,positive
1945706,im glad bc i would miss you on lj if you were gone for good,negative
1953617,kicked out my room for squealing year olds on the sofa for the night,negative
2367136,thinking and planning,positive
170583,"Am i really hyperventilating over my hair???  yes, i most certainly am.",negative
1013211,made it out of the bush alive you shud all be very proud,positive
2681322,lol i haven t yet it was nice meeting u too hopefully i ll see u at more outings soon i posted some pics on my facebook,positive
88906,Leaving the Twilight Convention  It was so amazing! I saw Kellan this morning at Breakfast &amp; later I will post my photos &amp; blog soon!,negative
3062059,from you hmm id guess about a day for every day from the christmas of,positive
1525397,5 days until I marry Richelle. God has been so kind to put her in my life,positive
1608937,i hope not too maybe its cause i m tired from the work week hopefully tmrw i ll be ok,negative
2084906,hate it i just have my french fries in office cute guy gave it to me lol,negative
1638549,deadlines looming i think it s going to be an all nighter,negative
376746,"@shifty_win - twittering again?? I'm waiting for leo, we're going to my cousin's place today... and it's raining.....",negative
1676848,i agree our politicians have turned their backs on the people again,negative
2239282,okay there is no way i m going to be out of here before the yankees game so much for having a day off,negative
1947316,friends are leaving me cause of this stupid love,negative
773526,"@LA_Decostified did the Redbox survey, got the code... And it didn't work!",negative
1370138,@CowsEatPie Why wouldn't I?,positive
84547,"cat just brought me a small, struggling rodent which was flailing, but unable to get up. Worst way to wake up in the middle of the night.",negative
1858453,won t be tweeting much today due to being back at school so tweet ya about x,negative
731252,I don`t like to continue anymore!  Four more weeks of weekly summary,negative
538964,@SRowl Taking my son to see a surgeon   He has a broken bone in his hand and they want to check it out - then just work - exciting huh,negative
939704,I need to clean my desk. Perhaps it will help me organize my mind,positive
730412,@grum haha pretty sure you need to go to exotica for that! haha  guess who cant drink,negative
1072935,@Lakers not tonight IMHO. He sounded like he's already counted out his team!  P.S. Thanx for answering,positive
2129871,just checked the weather report and it sucks why does it have to rain on my day off,negative
2455403,thanks abbie made a tutorial cause abbie chose the colors uploading soon,positive
2545782,school home later i love you lt,positive
2066544,i want this crazy rain and shit to hit here any regular day in h town,negative
725839,"@jbird7176 yeah, the first one IS kinda practical, but it's a fun read, too. now i want to watch lost",negative
2500775,oohh i haven t been on for ages i will stop by tomorrow,positive
311887,Someone bring me a mattress. I don't wanna sleep on the floor,negative
2280122,omg his mum lives selsdon byron road u kno it i like croydon too good vibe good shops and no cus i live in essex now xx,negative
1532500,@vickyjones91 With me by any chance? and apparantly a bit of Emily Cliff now too,positive
2963289,doing alright and you,positive
2338741,jesus i m sunburned but it s been a fantastic year anniversary i just wish i had the night off,negative
2022672,i hate that feeling,negative
74740,hey guys my phone is cut off. So idk when ill be able to text,negative
283749,@alexandramusic alex  you havn't twittered as much since you been back,negative
1734722,at least you can go to dos,negative
1715491,driving to the cottage stuck in traffic,negative
2852871,the korean face of pixar s latest star is via he has a cute face,positive
812558,Hopefully this is as addicting as ppl make it out to be,positive
2097939,wants her dinner now but has nothing to eat,negative
1647507,at work but still not feeling so hot there are bagels beside me and they smell so good but no appetite,negative
1660605,walkinf around new orleans leave at,negative
599006,"Only maths to go, omg, i am going to fail, no doubt",negative
502123,I hate going back to work! i need another roadtrip!,negative
399747,@charlotte__mae i was unsure as to whether i'd like it or not so i went for chocolate and it weren't as good as it used to be  xxxxxx,negative
681536,"&quot;WSJ: Jobs had liver transplant, on schedule to return to work in June.&quot; If this is true, I truly wish Steve a full and speedy recovery.",negative
1459569,@SiddNZ  your big day is more important than any dinner ;) mos def you can call me uncle  can't wait to meet you!,positive
492659,Why are most chinese companies enjoy killing dolpins and whales so much? Just to make money.,negative
2402252,sorry you in class all day for real if you want me to call in an emergency fake of course just let me know,positive
2039922,still have a few moms in need military mommy with little ones in ok needs a tv amp another abused mom in ut trying to get out of state,negative
543032,"@laureninspace I've missed my wireless too, it's been over a month! Also, what happened to you that is awful enough to be on FML? Aw.",negative
2337575,i want g signal no fair,negative
1977030,are you staying on i need someone to talk to,negative
1459274,@KavenB ... especially since i've been waking up early for it!! haha. Nd we're off school 2moz too (L) yay!!,positive
450135,@loudersoft  You okay dude? What's wrong with you?,negative
1679442,i keep hearing about this convention but who can go,negative
898836,AEGlive Middle East on its way to Qatar Doha setting up the Enrique concert  May 6th,positive
227070,tomorrow will be one month since my mom died. i miss her sooo much,negative
2672781,always keep those blessings comin,positive
1654202,lol woow thats how i was back in middle school then i slowly died out of it who knows maybe we will reunite,negative
106641,Why did I start crying during Asher roth's performance?! I freakin love college and I'm gonna miss everyone! I don't want 2 graduate,negative
2706199,cold cold it s freezing in here but the company is awesome,positive
572472,@thisiswilson I called his 'house'. He was out.,negative
1845567,i ve had a lovely day pottering in the garden sadly it s back to work tomorrow for me so not as much time to twitter,negative
3084864,probably not since japan is a bit far even if he were there feet of robot would present a challenge,positive
1143295,..rockin the center part like there's no tomorrow. what will tonight bring me,positive
456153,"@Rackap my bday is july 17th!- friday. i would LOVE to move there. but money is an issue, and plus the fact my son hates it there.",negative
1868637,i wish i would ve seen the mtv movie awards,negative
531105,I have a good relationship with my bro but sometimes he randomly makes an unprovoked verbal attack towards me.,negative
2398093,dad just let me have two raspberries haha thanks,positive
1953957,is gonna watch quot he s just not that into you quot which i can definatly relate to at this moment,negative
1682282,hides the real iweb generated navbar annoying yes i told the grey to quot go to back quot but it doesn t work,negative
2038711,mins have passed and my tutor which is supposed to arrive is still not here i should have slept in amp watch,negative
1687710,i didnt know i could get sunburn this early in the game its not even summer yet and i am red like a tomatoe happy mothers day,negative
1531349,"@salesmilestone Ah, well.... I can't speak for any of them",positive
611921,@mintchipking haha errrrrrgg..hate you! i was tired,negative
90281,I want a lemon of my own,negative
332893,@jmtimages Hi...Guess you have known that we cannot log in Flickr from China..,negative
351027,one final down. Only four more to go,negative
2308834,why did you stop the show i wanted you to fall off your chair,negative
2790198,having a good day so far carolyn says hi,positive
2284893,has never been so happy to drive through the city of atlanta just a hop skip and a jump until we see chipper driving to alabama tom,negative
814597,super tired but super excited that all my keys are working now  hahah with A.Cogg :],positive
1957009,its friday night too bad i can t party gotta work tomorrow,negative
1257643,"@Dr_Itor Yeah, it was mentioned.  It was the main reason for the conversation.  I'll have to fill in the details.",positive
1535060,Old hannah's are so funny. The new ones are best,positive
2390090,and to go back to an earlier point we can all agree i m right muahahahahaha,positive
614939,City By the Se was really good I just wish that Gina had come back for Angelo Poor angelo,negative
851892,"@goobiegirl that's what's important  coffee time! almost fell asleep on the keyboard, lol",positive
1895083,oh please do not talk that way sad to put quot summer quot and quot last quot in the same sentence in this instance,negative
1739332,is looking forward to chicago but sat that i wont see __ for a couple of days saddddd,negative
1994681,sounds fun wish i was closer,negative
2530687,i m hungry soo i m going to eat with my mom yeiiii,positive
1641700,i wish we would get fully staffed already i m tired of interviewing and doing other people s jobs,negative
158583,trying to go to sleep. But I'm not tired anymoree,negative
2101824,cant find a paper due today for my final fml,negative
170823,"@Saz_xox  Oh god, everyone's dying.  But it's mainly justin depressing me",negative
2898173,some delicious items should not be twitic d they look scrumptious,positive
1715892,yeah it s a bit out of my price range too unfortunately,negative
1482019,TDK is even better the 5th time round lol,positive
2713122,i m going to follow the one with the picture uploaded,positive
198682,Oh crap. 11.40pm and I haven't started exam-revision. This will not do!!!,negative
3023178,just left geyser falls with team guynes so much fun,positive
1262201,@worldmovesfast  trouble wants her home back.,positive
2776448,damn near yes,positive
192181,Put our 16 yo beagle to sleep today after a two-month health battle.,negative
2033580,ugh school m and i still hav about pgs of a book to read,negative
652196,Yo it's to early and my lower back is KILLING me!,negative
2836692,hey guys gotta go later,positive
256194,up in 3d was sold out for the entire day  headed to santana row for pinkberry,negative
580377,I just saw a 70-year-old version of myself.  He was riding the bus,negative
2586312,oh yeah i ll rescue you this weekend,positive
1011254,can't wait to be in car and head to Opatija. maybe we be in final in something. . now wouldn't that be cool,positive
890002,@Draeco yess i did figure out why,positive
1275632,practicing for an audition at 2am. i am very smart,positive
209285,@Iamneiman  - They are beautiful ! I had a pinsher like Dexter that I lost,negative
2206599,i love that documentary i cried too,negative
598002,Im at work and its not good have a fight with my lover and things r not good   face for me...but what can one do when others little drunk.,negative
2782681,why not i m a fluid loverher i keep saying that just get a cup and take a sip i m good for you,positive
2965059,study break even tho i wasn t studying with katie rose to visit my fav employee of the month nun yes,positive
2456467,next time you should try to get a jet blue flight they have yet to let me down,positive
188027,"scrap that tweet, indian, dvds and everyone else. when is it going to be just me",negative
1248559,"@levarburton Congratulations! I've never smoked, but I saw what a tough time my parents had quitting, so I know how hard it is.",positive
646634,"Jfc guise that article was so cute, goddamn ronnie I want you in my utah valley",negative
499488,@nerdist  They said the same thing to me and also I need to add two more years to my contract!!!,negative
3079123,is truly amazed at what the lord will do when u set ur focus on serving those around u he is so good,positive
787501,ankle killing....shouldn't have gone to the gym this morning  docs tomorrow. Northumbria Graduate fashion show this afternoon!!!,negative
2561051,it s about time for a great black movie with beautiful black people if i was a writer producer nite tweet freaks,positive
481154,summer school sucks,negative
699720,needs Jean Toomer's Fern right away. Halp please.,negative
316567,@DaisyKary but I heard him yelling at you for all those pink socks.  He's such a diva.,negative
452656,@kchicken lol. I can't get Ubertwitter to work,negative
3063609,good have fun bye,positive
1007072,@thebleachworks suffering today? awww pobrecito go get your self some good breakfast! glad to know it was fun! take anymore pictures?  xx,positive
2616998,medsurge exam done only the psych exam the rest of my clinical homework for the week stand between me and a free weekend,positive
2592724,heard the new version of see u in the dark,positive
2863058,well can t wait to finish reading them do you know what it ll be called yet,positive
1350993,playing truths with Ash and Scott.,positive
2262290,shoutout to my girlies who hang in their room too rain sucks on saturdays,negative
615049,Yaaaaaaay my day off. Bbboooo I'm stuck with the kid all day  parents left to S.D. And they say I'm the party animal!,negative
544911,Playing COD:WAW campaign since XBL is still down!   only 3 or 4 hours to go!!!,negative
2278839,thank you for your all show sunday i m ready for face time went on cruise and got none my last shot in toronto,negative
2140107,i d rather not s i actually dont know anything,negative
1542967,"Got sidetracked last week but I'm determined to make oodles of PB cookies tonight. A week late and a dollar short, but tasty nonetheless.",positive
1377245,@oh_laurensage No worries!  I didn't realize it was tonight. =(  Oh wells!  There's always the movie in Dolores park to look forward to!,positive
1890499,studying for crapy finals,negative
513106,the only thing that is worse than being ill is waiting at the dr's,negative
1301382,@Hollywelch aha  well I will make you feel better... Ah... I saw a spider and ran away then I tripped over crap on my floor.,positive
2081022,we went to sushi friend they have pc sushi on monday nights no veg though i want to try that any recommendations,negative
2628144,can feasibly sleep in tomorrow morning rehearsal at parade at,positive
655737,@ work soo tired,negative
2068107,bored to death at work,negative
1294479,@jfjvaneijk It was indeed a nice ride. A friend of me said he wanna join next time. So next time to Muiden for a terrace and back,positive
2870081,i think for me the most important ingredient is a toss up between honesty and communication both very high for us thanks for sharing,positive
2831099,doudou has nothing to watch out for i was just looking at them for lady but italians are indeed nice to look at,positive
1260473,"@kate_carris Aww, please don't hate on UPS...they keep my kids housed &amp; fed &amp; clothed by giving my husband a paycheck.",positive
2046968,oh im so mad its over i didnt want kobe to get that ring,negative
1990093,why did the yankees lose,negative
1479320,"@wholefoodie Aww that's so adorable! My boyfriend recently fixed blinds with floss &amp; tape, and I was so proud. He's such a cutie.",positive
2108825,looking for recipes for diabetics that actually taste good so hard recently diagnosed with type and can t find things good to eat,negative
60706,@Lisa_Veronica are you going to Massachusetts right now? I thought you guys were only going to play there on May 17th..,negative
1458297,@David_Ogilvie Good afternoon and happy Sunday. Wassup?!,positive
1524223,@genieswan have fun and enjoy the beach,positive
420186,okay i finally got one of these things. &amp; i want that old thing backk,negative
452807,"Finally, I have finished packing.  Now it's time for me to sit back and have nice long cry.",negative
1436487,Robert Earl Keen just joked that he had to do a solo song so rest of band could go check Twitter,positive
1728192,i had a sausage egg biscuit from mcdonalds i haven t done my outside patrol yet,negative
1888712,been to the gym walked rugby and now dinner time until late night conference call with japan,negative
625151,"had a great day with the bf. lunch. shopping at camarillo. then wanted to watch hangover afterwards, but he had to go back to work  sucks.",negative
494787,@dreamer728 oh bb.  but it's so bad.,negative
337981,"forgot to take my hayfever meds this morning and am now starting to feel the consequences  man my eyes are so itchy, this sucks!",negative
2520361,good morning twitterers i ve been up for a few hours already i just forgot to say good morning,positive
2964261,playing nba k with kevin,positive
64622,at work,negative
1909957,its so lonely up here,negative
1247385,new moon trailer is out?? :o   off to bed now  next guy just called me. and it werent even wrong number :| god knows who he was.,positive
2687086,enjoy your concert kina and have a great meeting with all the lovely kinerds lt,positive
899177,"Just found one of my medallions from back in the TKD days. Ah, the memories of being tortured",positive
2955214,hi i m from argentina i just want to say the you are an awesome actress,positive
2465633,indeed have a nice week,positive
368868,"@euphoniousbeing there you too go again, don't even take me......",negative
19944,@dswints just got home myself! I had an event I asked you to swing by!,negative
2375547,is watching the the hills episodes today seen them all a million times tho but oh well never gets old,positive
1309572,@ThisIsRobThomas So happy the first show got announced  Miss road-tripping so much to see you perform. It's getting real,positive
1789746,i feel like a part of me is missing when is out of town goodnite my love,negative
2025302,i know i know buttttt we cant do anything about it now,negative
2267254,re comment yep wait for the dns if you can t log in it hasn t propagated yet so you ll have to sit,negative
15265,I dont get as many emails without Megan Child here for me.,negative
1607985,about to walk through the gates of hell and rot for hrs with hundreds and hundreds of students ahhhh i hate it here,negative
1669357,was on tv,negative
1677935,those chi waver things look so cool but it would literally take me like hours to do that my hair is so thick sad,negative
3047198,can u stand on your head now,positive
2111499,my accent is all my own lancashire born and bred although i do seem to sound like ashley from corrie on video,negative
2915190,sports center was amazing i love you guys soooo much and cant wait for the cd and july th you rock,positive
2053978,you know me too well,negative
266929,I am going nutz at work!!! All my clients are phoning in and they all need me NOW. Fark.  Stroh rum please?!,negative
391879,ughhhhhh i just woke up i have to do yard work today,negative
2067554,yup that would be mastitis brutally painful for both woman and beast,negative
1991616,you might have to hold it down for me tonight,negative
1326009,@lovessunflowers Hehehe.. Want to become a bookmaker now? Better think twice about it!!,positive
1955030,school fair was fabulous home with a cake no soda,negative
2080268,get it how you live since apparently i m a quot call girl quot and all lmao i have to laugh to keep from crying,negative
2266195,quite often i wish i only dealt in ceramics you can just wash them in a bowl of soapy water been polishing rusty cast iron for hours,negative
1932787,i am hungry i was looking forward to an early dinner break but someone decided to suddenly booked a lesson at,negative
374257,@gwbell I disappoint. They don't accept iPhone coupons. I left the printed out version at home on accident.,negative
503195,Zumba was soooo tough tonight. exhausted and slightly grumpy.,negative
1844014,i know me too who do you want to win in the finals lakers or magic,negative
306223,@AmandaGahler i thought it was little weak.. i want Jay back...,negative
3074886,layed out in the pool for hours,positive
2243547,the day is almost over my son is sick,negative
2185131,wee i have mixed feelings haha p i feel very excited to be finished with junior high but also sad for leaving everyone,negative
288896,"@MauricioCBB ARGH, don't talk about Blackberries.  My dad won one, and i want it to me so much.",negative
2553103,huge weekend great gig saturday mrs graduated yesterday and she started a new job this morning i barely functioning this morning,positive
741281,think i have a cold... in june,negative
1559375,@jephjacques Happy early birthday!  Also: it must either be really fun or annoying to draw all those different beer taps.,positive
165941,"I hate having to put my toddler in a disposable, but her rash needs ointment. I hate her having a rash even worse.",negative
2922359,i checked out his twitter profile but i think it s fake found someone else though we love him all the same anyway,positive
1887172,oh my head is killing me one heck of a day too tweet you all later,negative
258811,Applying for Placements!!!! Wish I could work in America though,negative
2157947,i can t hear shit my ears are fucked up and everyone is being loud and i m being quite i just wanna go home,negative
2929872,its awesome gettting no u more u were so gr at both staff m and sisterhood we r so blessed to have you in our world,positive
1586114,@PandyxPanda Isang class palang  MTO. We were arranged alphabetically. Haha.,positive
1208901,@Adrienne_Bailon if u could follow me it would be awesome,positive
1764297,ohhh ok so like it s more frustrating i had my hands on a g iphone last week but it was upgraded so i couldn t unlock it,negative
2093054,boo at least you will have bootiful teefs after tho,negative
28900,is going to try and finish reading Breaking Dawn - boring part about Jacob right now,negative
2283327,wishing i was in dallas miley and jb concert there,negative
2700434,i m on a boat wait no not really but i wish,positive
1806583,wants a macbook,negative
2007345,the s keyboard is too loud,negative
2611971,at texas de brazil eating picanha,positive
1782442,i can not belive i got sun burnt today i tried so hard not to,negative
2253066,i woke up exactly pm haha i was so tired,negative
426389,Oh. It's gone.  Oh well. Twilight's still there though.,negative
2686409,thanks hope you re out enjoying the weather,positive
318712,I don't want to go to work...,negative
2416680,laying on the coach and watching some telly lovely weather today the sun is shinning can t wait for summer and the weather it brings,positive
614893,@ClashCityCo i have bad news  due to the frusteration and anger in this past week I am escaping to my apartment with my boyfriend,negative
45115,@ohashliimae wish I was there,negative
100289,@lilmisslexaaaa hey you don't like demi lovato! When I played it at my party you told me to shut it off.,negative
2773440,yeah there are some idiots about just need to ignore them,positive
141285,"@vboykis Sadly not.  I live in a leafy corner of London. No moors although two foxes were, well, doing it in my garden the other day. :-/",negative
572756,"@aleanathem, i just wrote this whole big comment down and for some reaosn it didn't save it  noooooo!",negative
1788590,even i don t see what you mean i still don t get these hash tag things,negative
1295546,"@warrenellis  No doubt about that! I believe a neologism is due to describe such power, what about your EnglishawesomenessNESS?",positive
1969128,i m going to miss yours and petes shows,negative
2304175,glasses of wine and i m not even sleepy if that doesn t make me tired then i don t know what will,negative
1370102,listening to some old school bobby brown.  All Day All Night...that's one of my faves.,positive
1765138,does anyone know where i can watch the prison break tv movie it s not on itunes,negative
1487348,"@ideologyNZ thanks! and yeah - She's doing some Google Analytics work for us, contracting from up the far north",positive
1709734,good morning tweeters i think i over did it yesterday my body is kicking my ass now,negative
2862916,well you do a good job at it,positive
2048674,morning tweets well i ve got into work on a bright sunny day what a shame i have to work,negative
1741624,there s something wrong with my computer and it s not even a year old,negative
612030,I have to go and make dinner .. but I can't leave him! gosh it's so hard  hought it would be easier,negative
99451,"I am sorry for being so happy that Pahang has been cancelled. Okay, Im not happy. I am sad  because that means you people cant go.",negative
662434,As usual with carriers you never exactly know what will be your bill. I'm kinda pissed off with that,negative
2701726,drinking champange at coco with cass and jaz,positive
1421059,"I'm now available on Skype.  Am I really that pasty, or does computer video make most people look that way?",positive
1256617,"@kevinmichaeldic Thanks! The actual problem is that after it uploads, the picture does not appear. Maybe it just didn't like my photo.",positive
331958,@SamBennington PS: I can't get the links to work to your Life Coaching site.,negative
2163204,going to study more grrrr,negative
851470,Bored now. Today seems to be going well. Just wish it would go a little faster. I wanna go play guitar hero and eat cookies,positive
2501190,that last one may have been my best ever heh,positive
619106,A rainy cold day..I wish i could find my hp books...,negative
2065553,i think i am getting sick could you take me home to rest,negative
1687219,watch channel is freaking me out where is domo,negative
1229558,going to art class,positive
1276054,Tricking paris to go to sleep is easy!,positive
