ID,text,label
204853,My dad hasn't called me yet!!,negative
1510765,@thecurelist Like what you are doing with your site. Keep it up,positive
2142359,thought we had a great retail space in apex picked out but there s a lease pending back to searching for a location,negative
134631,"using rails and firebird is so cool, too bad rake db:create does not work though",negative
367778,"@AdellesLover The DOTT is dead, remember? It's the &quot;DLPW&quot; now.",negative
957405,"Passing exams doesn't really matter in the scheme of things, does it?",positive
252844,@TillyRossetti  i just had some too- but unfortunately i didnt get magically transported back to the nineties as i had hoped..,negative
2476239,got a sunburn from coney island bike ride,positive
2524661,yeah meet us there i ll give you a ticket,positive
1628379,my weekend is going well thanks for asking hate that it s almost over,negative
579833,My car won't start!!!!,negative
294297,"at home with a sick kid, starting to feel sick myself. dammit!!! cleaning for three hours straight may not have helped.",negative
1397386,is going to put her jim jams on and watch films all dayy  PLAN!,positive
196519,"is sharing her bed with her little boy who has an ear ache, not fun having a bub in pain",negative
1400688,We are lazy bums... Slept in past 10,positive
2047594,is excited about norway but is not looking forward to saying goodbye to the three most awesome people ever,negative
1637397,i bet they say that to all the users,negative
2570866,no fb restricts the number of updates not to mention that s not an update on you so they don t put replies on fb,positive
325162,Nooo.. Ravelry is down.  ,negative
3066955,playing wiffle ball,positive
2344782,having a great time out in oklahoma but missing everyone back home,negative
1278722,@BackStory What's next week's topics? I learned a lot from earlier's show...,positive
2196516,bored nd got nothing to do,negative
204405,"Watched FA cup, managed to miss both goals  gettin drinks. Ah well. Lions won, so hope Wales can give Canada a good thrashing",negative
1329096,loves his new Twitter-BR-Image,positive
502463,Is really really sad!,negative
2302717,hmm petted and felt his bones entirely too much all over his body eating habits still not good hmm,negative
506531,@kalena1995 a  i sowwie. and it hurts from texting so much with my full keyboard.,negative
2201366,currently working from home with a busted ankle,negative
2331181,twug i needed a twug too i was supposed to come to the show tonight but my aunt is having her baby so i can t,negative
2040172,bummed the weekend is coming to an end,negative
3055494,it s all good in the hood i still got love for ya and you re still my favorite sexy pirate partner in crime,positive
1227170,"@danitatex thanks for follow, know what ya mean twitter seems to get very addictive when ya need to sleep, it gets better when your tired",positive
429204,No kiddies at home! tonight!,negative
1511313,&quot;Anvil&quot; was just awesome and heart warming and it involved heavy metal,positive
1987915,i tried real hard and couldn t find anyone to go with,negative
238488,Regarding my last tweet - I don't think human race will civilize itself,negative
1218022,This guy &quot;husile&quot; at Neowin cracked me up:   - It looks as if he's pissed at me not releasing BlueSE soon enough,positive
2303995,phone is currently not working i havnt had a chance to pay the bill yet ive been a busy bumblebeeeeee,negative
879101,@ShawnNelson Did you go and see Wolverine? I figured you did and that's what triggered the tweet.,positive
2859431,in the igloo doing some flash dev making a tabbed ui today,positive
1536530,hangin out with my fave aunt and uncle and my fave cuz and my bros and sis and of course mom and pop oh and lets not forget the cats,positive
2421409,yay for loss of teens have a great night,positive
2694524,liger is my older brother,positive
823559,i want a cellllllphone ..,positive
495322,"bachelorette time, but just not liking this season after all the stuff being said, seems fake",negative
608164,The wait for this She Wolf is killing me....,negative
1655678,nope we miss out its ok tho,negative
2247471,you have broken my heart i can t believe you joked around about cheese that s uncalled for,negative
2274745,bored in home someone funny,negative
317727,suffering with hayfever today,negative
1986004,um what is she hideing lol i dont know what to tell you about it all id come play britney at ur party,negative
75264,@calvinharris that's just wrong on so many levels.,negative
333564,No Internet at the new apartment until next week...  just iPhone.,negative
1649181,you didn t invite me how dare you hanna haha,negative
1636525,doing good have about hr of work to do before bed its am,negative
29393,"Off to bed...back to work tomorrow,",negative
1476645,@ladymaryann watched it!,positive
1289325,@alansuspect i'll be finished in a few weeks time. so yes working like a demon at college at the moment.,positive
1888440,not funny it made me mad,negative
1755097,thinking of animated profile pics don t pics that move while trying to read rocking back and forth up and down distracting amp urp,negative
1427781,wants a bunny rabbit,positive
1256609,Wow what an amazing night of MSN - thanks to all those who spoke to me - it was great finding out more about you,positive
2244471,yes sct is up but listening to guest speaker paul dellechiaie designer of the ethos eyepiece he didn t bring free samples,negative
2402486,but i will make it up to you with paddle sanding and a hike sometime this week if you like prev am,positive
2680026,leaving german beer garden headed to home base manhattan,positive
559498,@MiaLee30 i forgive you sleep is an important thing and my lack of it is making me ill  the thought of bmth just makes me worse :O,negative
2833150,yeahh i recognised the photo i was there too,positive
2364798,my heart broke into pieces,negative
188406,@giraffe_legs Naw. But its my fault cuz I haven't applied anywhere yet. I have no drive.  I'ma apply at the former Tweeter Center though.,negative
2868242,anything that evanescence sings is per definition gay in my book which is good and that cover is pretty awesome,positive
1885141,ha i just don t think it will be as good as the tech demo also this has to be a pedophiles wet dream,negative
3104100,see how facebook has a concept sliding from social networking to a semi microblogging site because of its ing,positive
1297958,"Just finiiish school, and wanted to tell you that Bethany has a fanny in her name, Bef-fanny, see?  ",positive
643947,"@shanedawson awe shane I just watched your fathers day video! I know Exactly how you feel, my dad passed away when I was 9",negative
2746287,about to get a good hours sleep,positive
1143149,is watching the da vinci code with cousin daniel,positive
570824,In the mountains for the day.....no service,negative
2299604,waited for davetoday but he snuck out the secret entrance and elevator,negative
1925623,i m going to need a new pair of hands by the end of preliminary geez this homework and essays will be the death of me save me,negative
1136140,"@livefreeortour ahhh I'm sorry I was creeping on your tweet,hahaha I WANT ONE,hahaha it looks cute",positive
2856193,that definition would fit me nicely,positive
1558273,"@pi2dn11 it's really good all I buy is organic now, what I do is try to find everything I do like but organic. I get creative with it!",positive
1628061,for some reason when i woke up this morning my allergies were horrible i now finally got back my sense of smell,negative
284280,Forgot to deactivate my Fw CS4 to add my serial. Today it wouldn't launch since it expired. Winding the clock back was the only solution.,negative
2512273,foldn some laundry what a sat nite lol its allll good as long as im w essssssex,positive
602975,Can't find someone to work 3-7 for me so I can see my son graduate 5th grade.,negative
2746502,i could do that,positive
549117,@malizzle303 Hunter and his friends.  Hunter and Ben sat right behind us and bothered us the whole time,negative
81308,I want to read but i know i will fall asleep if i do.,negative
565029,amazon fail I decided to buy some mp3 downloads from @amazonmp3 this morning with a gift certificate. It just charged me without asking,negative
2726445,you could always cultivate your inner super geek and do music,positive
1308273,I had fun with you two ladies today... Glad you guys could make it.  thanks for coming.,positive
1851449,i m sad too i m definitely going to buy the season tho,negative
2051981,teething has been awake most of the might she s lucky she s cute,negative
1249240,even though i have shaved my head guess what you can still donate,positive
1279401,@displacedmoose Hi...yeah. It was a good turnout. Town was busy so I don't blame you about the parking,positive
2304733,when tom coming on i wanna talk to a friend and sadie and stacey are busy,negative
119407,I love how NO ONE wants to hire me.,negative
3093671,i forgot that adam brody has a guest spot on gilmore girls i am geeking out right now,positive
2328493,ed mcmahon is dead unfortunately i am correct sir,negative
2133112,i soooo crush barry watson during those days good u zerogravity isn t played in manila s radio stations yet,negative
2718031,lots of advances in treating ttts since our girls were born,positive
2623983,great tips i m always looking for ideas to blog about so both of those will be helpful thanks,positive
786228,Don't know what to do today,negative
1821837,is hoping that the girls he just hangout with don t think he is a freak,negative
425615,Having issues charging my phone. Using Pastor Abel's laptop that had gone to sleep and took the charge away,negative
1362990,thinking about how cool it would be to have a ball pit in my room. like at mcdonald's but much cleaner,positive
466096,@DonnieWahlberg is what I'm reading correct?? NKOTB have cancelled to OZ tour?? please tell me it's not true,negative
1232537,So my boss didn't show up for work today... Instead of calling him my co workers and I decided to take the day off  ha ha,positive
1020437,@choose2befit enjoy is certainly a relative term when it comes 2 p90x  training 4 an ironman was easier than working out w/ @Tony_Horton,positive
1492158,@CCArquette hey! Cougar town looks really good  do you know if it will be coming to England? Thought dirt was amazing by the way! Jen x,positive
448573,Im off to bed now school tomorrow,negative
769199,@Mattit_TOFY My furniture is white. I think I'll consider yellow! I have a yucky cold grayish wallpaper on the walls right now.,negative
2735259,anyone interested with my st ebook in lulu com only,positive
731744,Finally reading the chapters for my exam tomorrow - 1 down 9 to go.,negative
2662241,i just saw your i m sorry anyway don t be jealous of my lifestyle you ll have it one day,positive
281870,I wanna Go biking but I don't have a bike  lollllll,negative
1896723,wishing i could do the drumming add much,negative
2912931,the drama in august rush is a bit over the top but its got great music none the less cant help but hum its tunes once the movie ends,positive
2469592,beto s pizzeria is on banksville rd in i believe the beachview area sorry to answer like years later,positive
2849259,i was a little while ago lmao lt,positive
188923,I tried the best I could to make baby cheer up but nothing seems to be working,negative
936723,"@KimSherrell I've been really great thanks, shedding the stress of corp life, now working freelance and its beautiful  and you ?",positive
2194997,in va until saturday than here i come nc back to pa on monday,negative
3037721,had a fun filled night,positive
459069,I'm keeping that beard forever.,negative
2732890,wow you are a busy guy,positive
2195603,thanks so much i think these are usually card specific though bummer because they never send them to me anymore,negative
2935503,okay but do not be sad because today is day of the party,positive
2545825,keeps forgetting i m on twitter wow we have a lot to catch up on guys,positive
594010,i'm like all sleepy at the ofc now.,negative
348020,I'm pretty sure my stomach has waged war against me.,negative
1901127,just woke up from do awful dream now i cant get back to sleep,negative
2675807,oh yes i am i have sent you proof of that,positive
1689224,ok i m exhausted i need to sleep back to work tomorrow i m pouting talk to you latah good knight,negative
1096527,is sure that Archie will eventually leave Veronica and run back to the waiting arms of Betty,positive
475169,@OntarioDdubfan I've been good.  How are you?  I just wish that I was closer   Have I missed anything??,negative
2733944,way to twitter during service and nice job on them keys today,positive
260775,it really sucks that just watching my favorite show makes me miss her and I being best friends. im heidi and she's lauren,negative
19193,No one's following me!,negative
1528642,@coco614 Nope.  Read the ? again.,positive
427488,@toodamnninja isn't it a miserable day? Hope your mood improves ...,negative
2865897,lol i know that guy and i cant believe you haven t been following her geez abbey where have you been for the last century,positive
1638824,i m sorry for you guys remember i think of you,negative
643912,@ShapeThrower nope  seems they don't ship them with nitrous oxide...,negative
1712747,time is going realy quick today x,negative
2855174,what a month of may i m totally spent nothing left in the tank i can t believe i survived ok back to work tomorrow,positive
2660018,i m having a kometi with joy and my sakops and watching kmjs,positive
2207287,too tired to function,negative
1823690,awww that was silly now wasnt it,negative
1690418,just talked to my mom on the phone for hours and is currently a little homesick,negative
732243,Can't sleep... Too much on my mind,negative
2997647,love is what makes you smile when you re tired,positive
119419,"Is really not feeling the london weather tbh, I want to go on holiday ahhh",negative
3024341,that sounds like a corollary to murphy s law,positive
860659,@vap0rz Thanks man; I'll be thinking of you guys,positive
1890985,i still have to finish my pre cal not fun,negative
1858377,oh really i ll have to give it a try but i think i ll be too late to stop this year s delivery,negative
218937,just got home from the movie it was great altough it made me sad that rexy didnt appear much  but oh well it was cooooooooooool,negative
376577,I'm really hoping that the military didn't take my baby's care package because they knew food was in it.,negative
2953414,back from nottingham so proud of the driving now absolutely shattered going to spend the night writing my life away x,positive
623418,@wintersleep Have a great show tonight. I really wish that I could be there.,negative
496781,"ugh, i missed almost an hour of raw, when it was in north carolina",negative
1102087,"@cassandra2603 haha They did seem have a different accent  *glares* .  and yeah, I wanna know what they would have said if I had said yes.",positive
2952241,baby ducks are really cute patience is a virtue some of us have to work saturday,positive
561101,"I love Dewey from Malcolm in the Middle, he played Fuzzy in Cider House Rules; he died",negative
2879680,a little or large inspiration this is lovely,positive
2675876,still waiting on some music,positive
2876709,good morning right on i sure hope ur ready lol isn t the concert tomorrow i play the drums to but i play djembe ones,positive
1256568,This is fun!,positive
77486,"@salandpepper ...or even just Peter, I know",negative
496754,I really don't even know what todo.,negative
271683,Bellvue has a lot of crazy people... Most of them work for au bon pain  YIKES!!!,negative
2015141,day to alaska did a short day and stopped in lethbridge ab rained almost all day snowing in banff will probably skip on way up,negative
404736,@SupernovaGirl the nearest is pretty far away.  but...perhaps after the summer. perhaps.,negative
866497,"is headed to the bedroom to watch TV and chill with the hubby for the night. God bless and rest easy, folks.",positive
1432906,@sharpestpencil renovations are one of the biggest causes of divorce - chill pill and a glass of wine,positive
1443233,"@Shawna311 Totally agree!! Jess Alba should have been top 5 at least! I'd like to rearrange that list a little, haha",positive
611470,@ronij1 Didn't know Lemon was your fav. These are awesome too! Sorry!,negative
396417,"@LiiL_MisZ_Chaos .... i cant speak to youu, you told me to Shut up!",negative
1424505,"mmm, strawberries and blueberries with strawberry ice cream. tasty.",positive
1367116,@merylincise same here. where you going?,positive
1087489,"@SunnyBuns no, not at all. I've enjoyed are intresting (to say the least) conversations.  notastalker",positive
905727,Reminising on such a wonderful day yesterday with my family and my love.  Nothing like shooting some basketball with the men in my life,positive
1786241,my eldest son s ni number has just arrived in the post he s growing up and i hate it,negative
2452875,just watched amp commented your video that was awesome how long have you been dancing for,positive
395315,What hurts the most by rascall flats is my life captured in a song,negative
51237,@KrystynC I love THe Game like seriously.  They won't know until May 2o something as of whether it's being taken off.  I will be crushed,negative
2895707,i m having my clothes dryer repaired right now by appliance repair received a big discount bc i scheduled appt online,positive
1602080,hoping i can fall asleep after watching knowing definitely wasn t national treasure,negative
2780983,that s the best thing to hear on a monday morning,positive
2468183,shopping tomorrow i think yes,positive
2439958,reading my new magazine that the jonas brothers are on the cover of,positive
912438,@Clara_miss my best friend won tickets to see them from kiis fm!,positive
1438339,Still tired from yesterday! About to cuddle up with my babies and make it a movie night...,positive
2081120,bummed out that i didn t get picked in nyc marathon lottery,negative
2974469,thai cafe on westwood blvd has good rice,positive
722048,agh the pain... me thinks my wisdoms are coming in,negative
1847057,i know i almost cried it doesn t help that i have leather seats stupid nashville i ranted about it on my blog lol,negative
1681965,yeah trying to recover my jap series from my corrupt hard drive,negative
2470103,gotta go drive my dad around today but i ll be back this afternoon,positive
1126988,"@Warlach  Make sure you tell her that, and often.",positive
1628578,sitting bored in my house,negative
919380,Who's going out tonight? I want to go out  xxx,positive
1910143,trying to get ahead of my work schedule so i am not so behind when i get back from wisconsin i don t think it is working,negative
1666246,my faith has grown my future is promised my family is protected my foundation is him my reactions will show my faith level zorras no,negative
1663871,we won t be able to watch it then so out of order x,negative
1110596,is going to get all 3 said it all singles  just for the nice cover sleeve to hold them in  yeh i am cool. do not lie!,positive
3017910,comma splicing is just the sign of being a real writer you re aiming for poetic flair instead of perfect english grammar,positive
455525,Why does meatloaf take so long to cook? If jeni were around she'd blame the communists,negative
1851243,sorry to hear that girl,negative
313783,"too bad, mitchel mussos's album didnt come out in Estonia .  and i didn't see the Lil'Wayne's album neither. :S saaad.",negative
2255835,i totally just entered a silent auction to win jonas brothers tickets i m so cool i probably won t win though sad face,negative
571711,uggghhh having trouble getting his music from his old shitty computer to his new macbook  can anyone help?,negative
2335187,i just got smoke in my eye,negative
990118,"@undercoverginny *hug hug hug x a gazillion* love you too  So excited that when I come back, I'll have a you!",positive
2633277,very quiet a little sad but my goal is to get lots of rest they re at a father son campout,positive
2692688,yeeeaaayuuuhhhh magic are going to the finals,positive
1735539,i need to study,negative
1634164,i need ppl to text me with there numbers i lost al mine booo i hate painting garden furniture,negative
2948088,thanks for the follow friday hope you are having a good weekend,positive
1582237,at lunch with kbr! yumm,positive
2297814,misses his girlfriend o o,negative
2772325,it s difficult to get used to,positive
2230266,i don t know what to do with research,negative
1385204,@janet_rosie I thought he was good in Notting Hill which I just watched. I'd probably have a preference for Liz Hurley rather than Hugh,positive
1620586,says my poker ranking is going so so down,negative
1514718,@detlef_c  ah is it? It means Bengali Day,positive
137523,this is not my place,negative
2570295,pah my parents i aspre to be far greater than they ever were,positive
153926,noooo  i've forgotten how to play 7 things on the guitar... it's been a while.,negative
32144,Sitting at computer and kinda bored doing a bit of science case study,negative
899284,"Monday, not going to work. Closing my door going to finish my assignments. @savitarani goodmorn  @d33pak opportunity to get a Blackberry",positive
1873491,while you re here what is the password for your channel i cant find it again,negative
323098,"At home after 4h of training with hills, need to rest now...  I miss my wife....",negative
2997873,got a email from my wife that she stays at her parents house tonight yeah i m single for tonight yatta,positive
343335,"my little brother is going to be in junior high next school year. he's growing up so fast, i want it to stop",negative
1765880,i hate not bringing my ipod to school,negative
2962562,wow you just opened urself for some interesting tweets back have fun reading those,positive
772080,@MeiMei_SungBuhh Can't you try to come back? We really do miss you and your hands,negative
1938961,is very worried about taytay he s sick i hope he gets well amp feel better amp back to his old self very soon,negative
1696684,i gain and lose about followers a day darn bots i m living for the day that i ll be followed by a real person,negative
1690263,the weekend is over sad,negative
124718,"Why is every lockable postgrad desk not available until next year? *head thumps on desk, ever so ungently*",negative
2599383,must have been quite an experience would love to do a climb like that if i were in any sort of shape,positive
2027262,lmfao t pains quot big ass chain quot i could do so much with k,negative
2120354,aww that s so unfair well theirs always that offer of a male stripper but i think we ll have to hide his guns first,negative
1051835,"Internets been a bitch all day, tis all well now though",positive
2049803,quite disappointed there was not storm last night,negative
1906458,oh no i just lost a lovely vintage telephone still trying for another,negative
248536,i have what is quite possibly the most boring bedtime reading ever,negative
3108268,lol ice cream is happy food hope that scoop makes you a little happier,positive
1903287,feelin better still wish i was home tho got more hours,negative
2079449,so irritating i m trying to remember a song based on the music video and all i remember is a white room and a saxophone,negative
2986328,day no bars great night at and playing rockband and etc thanks you guys next time we ll bring beer,positive
1389533,very nearly wedding time!!,positive
1257558,@lilyroseallen he say this about you but i'm sure he is sweaty EVERYDAY   ki$$,positive
2200406,is sitting in the atlanta airport waiting on a delayed flight,negative
964463,Just made a HUGE airsoft order! I canny wait for it to arrive!,positive
2900885,baseball this weekend i hope we win doubt it though,positive
1359991,@JeanneCant I'm excited about it,positive
418391,I'm bawling my eyes out while watching Titanic. I've seen this movie 100+ times. I'll never let go.,negative
2115968,yes gang up on me i was thinking more wasp bee,negative
1714358,hey my inforks fam please send your best wishes to he has the stomach flu really bad,negative
936715,back on the lottery winning streak,positive
2123796,had stir fry for dinner alone,negative
2329826,had so much fun last night with going to miss everyone,negative
984611,races this saturday  members lounge wew,positive
2877111,i just remember that i havent eaten anything today but its pm,positive
2063086,school again after weekend makes me not happy,negative
3063128,unbelievable hope the us give italy a run for their money too a little later,positive
574302,new hair... and a to-do list that is wayy too long,negative
2958893,it s a great avatar nothing wrong with that,positive
737115,has gotta help my mum wash up  Bad times!,negative
2073151,i really need to get out of the house i miss civilization,negative
153999,summer just got a little worse,negative
2118057,rip bicycle what happened to it,negative
1152711,Today was both tiring and fun  and my sister was there for most of it. I love her! ,positive
1608966,trying to get rid of a stupid virus off of our computer hubby accidentally opened something ridiculous,negative
2674039,where did you get that from,positive
1085814,"Blog - Qavimator, how do I do this please: Yay! Someone who reads maybe knows the answer I hope  I have .. ",positive
1482667,"@MRGOULD Funny, planning to see you live again makes me feel like &quot;drinking fountains, shorter than they used to be&quot;",positive
38262,@mrhemeyer because you were waiting for me sorry,negative
1176867,@StarrLab my Dante!  omgoodness I've missed u so much!yep I'll actually b there once in June and in July. Can we record wen I go? Xoxo,positive
2038530,wish i was at the tlth dvd release tears,negative
1779589,game over i need my cavs to make it tomorrow,negative
512948,"Hope I can sleep tonight...LOL!!! Love the beating heart, but I have a very difficult exam tommorrow",negative
